title,url,summary
쇼핑왕 루이,https://pedia.watcha.com/ko-KR/contents/tlLBkdR,"복잡한 소비의 도시, 서울 한복판에 떨어진 온실 기억상실남 '쇼핑왕' 루이와 오대산 날다람쥐 '넷맹녀' 고복실의 로맨틱 코미디 드라마"
수상한 파트너,https://pedia.watcha.com/ko-KR/contents/tE0JG2P,"기소 성공률 1위를 자랑하는 검사 노지욱, 태권도 유소년 대표 출신 수습 검사 은봉희. 두 사람은 온갖 사건들을 함께 겪어내며 서로의 마음 속에 자리잡기 시작한다."
순정에 반하다,https://pedia.watcha.com/ko-KR/contents/tPyXe7R,"피도 눈물도 없던 냉혈한 기업 사냥꾼, 뜨거운 가슴으로 사랑에 목매는 순정마초로 다시 태어나다."
술꾼도시여자들,https://pedia.watcha.com/ko-KR/contents/tlYeyo8,"하루 끝의 술 한잔이 인생의 신념인 세 여자의 일상을 그린 본격 '기승전술' 드라마, 그 두번째 이야기"
숨바꼭질,https://pedia.watcha.com/ko-KR/contents/mdReMLO,"고급 아파트에서 완벽한 가정을 꾸리고 사는 성공한 사업가 ‘성수’(손현주)는 하나 뿐인 형에 대한 비밀과 지독한 결벽증을 갖고 있다. 어느 날 그는 형의 실종 소식을 듣고 수십 년 만에 찾아간 형의 아파트에서 집집마다 새겨진 이상한 암호와 형을 알고 있는 ‘주희’(문정희) 가족을 만난다. 어린 딸과 단 둘이 살고 있는 ‘주희’는 자신의 집을 훔쳐보는 누군가의 존재를 느끼며 두려움에 떨고 있다. 낡은 아파트의 암호를 찬찬히 살펴보던 ‘성수’는 그것이 그 집에 사는 사람의 성별과 수를 뜻하는 것을 알게 된다. 형의 아파트를 뒤로한 채 자신의 안락한 집으로 돌아온 그 날, ‘성수’는 형의 아파트에서 봤던 암호가 자신의 집 초인종 옆에서 새겨진 것을 발견하는데..."
슈츠,https://pedia.watcha.com/ko-KR/contents/tE6Yk1q,일본 4대 변호사 사무실 소속인 변호사와 그의 파트너가 다양한 소송에 도전하는 이야기를 그린 드라마.
슈퍼대디 열,https://pedia.watcha.com/ko-KR/contents/tlGz7bP,"여기, 졸지에 바닥에 떨어진 두 남녀가 있다. 최악의 독신남과 최후의 싱글맘! 하루아침에 시한부 인생이 된 싱글맘 닥터가 혼자 남겨질 딸을 위한 마지막 선물로 최고의 일촌 아빠를 만드는 분투기를 그리고자 한다. 실연의 상처로 최악의 독신남 환자가 되어버린 첫사랑을 찾아 최고의 일촌 남편이자 아빠로 성장시키는 과정을 그린다. 그리고 시한부 재활 결혼이란 여정 속에서 생에 마지막 러브레터를 써나간다. 이를 통해 참된 부부관계와 진정한 사랑의 의미를 성찰하고자 한다."
스마일 어게인,https://pedia.watcha.com/ko-KR/contents/mWvqwPM,"웃어라 그리고 죽어라
절대 살아 돌아올 수 없는 악마의 제물

특수경찰대원 카밀라는 슬럼가에 숨은 갱단의 아지트를 급습하는 과정에서 갱단의 습격으로 대부분의 대원들이 희생당하는 사고를 당한다. 카밀라는 때마침 벌어진 사이비 교주 알비노의  강령술 한가운데에 떨어져 온몸에 심한 화상을 입은 채로 혼수상태에 빠진다. 기억을 잃고 깨어난 그녀는 친구인 파티마의 도움을 받는다. 하지만 기억을 잃은 카밀라의 주변에는 사악한 기운이 맴돌고 주변 사람들이 웃음을 지으며 자살하는 기이한 사건들이 벌어진다. 저주를 받은 카밀라와 파티마와 얽힌 끔찍한 비밀이 밝혀지고 사이비 종교 알비노 일당들과 최후의 대결을 벌이게 된다."
스무살,https://pedia.watcha.com/ko-KR/contents/mO0gmDR,"셰프를 꿈꾸지만 도전하지 않는 ‘찰리’. 카페에서 일하는 러블리한 매력의 ‘앰버’를 보고 첫눈에 반하지만 고백을 망설인다. 밀당 고수 베프 ‘벤’의 도움으로 말을 걸어보지만 ‘앰버’는 이미 4년째 연애 중. 말이 잘 통하는 ‘찰리’와 ‘앰버’는 둘도 없는 남.사.친, 여.사.친이 된다. 하지만, ‘앰버’는 순수하고 때로는 엉뚱한 ‘찰리’에게 점점 친구 이상의 감정을 느끼고 남자친구에게도 말 못 하는 속마음을 그에게 털어놓는데… 아슬아슬 친구와 연인 사이를 오가는 ‘찰리’와 ‘앰버’."
스물다섯 스물하나,https://pedia.watcha.com/ko-KR/contents/tPvbdkK,1998년을 배경으로 사회의 혼란 속에서 만난 두 남녀의 사랑과 청춘 이야기를 그린 드라마
스웨덴 세탁소,https://pedia.watcha.com/ko-KR/contents/tEQ4LDl,"사랑, 우정, 취업 등 타인의 고민을 볼 수 있는 초능력을 가진 평범한 여주인공 ‘김봄’을 통해 일상 생활의 단면과 인물의 심리를 디테일하고 코믹하게 표현한 코믹 판타지 드라마"
스위치 - 세상을 바꿔라,https://pedia.watcha.com/ko-KR/contents/tEKm0jP,"진짜와 가짜의 콜라보! 사기꾼에서 검사로 얼떨결에 롤러코스트한 사도찬이, 법꾸라지들을 화끈하게 잡아 들이는 통쾌한 사기 활극"
스위트홈,https://pedia.watcha.com/ko-KR/contents/tRX51M8,"욕망이 괴물이 되는 세상. 그린홈을 떠나 새로운 터전에서 살아남기 위해 각자의 사투를 벌이는 현수와 그린홈의 생존자들, 그리고 또 다른 존재의 등장과 알 수 없는 미스터리한 현상들까지. 새로운 욕망과 사건, 사투를 그린 넷플릭스 시리즈"
스카이캐슬,https://pedia.watcha.com/ko-KR/contents/tRWm15D,"대한민국 상위 0.1%가 모여 사는 SKY 캐슬 안에서 남편은 왕으로, 제 자식은 천하제일 왕자와 공주로 키우고 싶은 명문가 출신 사모님들의 처절한 욕망을 샅샅이 들여다보는 리얼 코믹 풍자 드라마"
스케치,https://pedia.watcha.com/ko-KR/contents/mOVvwpO,"“우리는 이것만 있으면 돼.
담배 몇 개피, 커피 한 잔, 그리고 약간의 대화.
너, 나, 그리고 5달러.”

다큐멘터리 감독을 꿈꾸며 어렵게 방송국에 입사한 리레이나, 자유로운 영혼을 가진 가수 지망생 트로이, 그리고 대학 동기 비키와 새미까지. 대학을 갓 졸업하고 이제 막 사회생활을 시작한 4명의 청춘 앞에 놓인 현실이 녹록지 않다. 꿈을 쫓아가다 부딪힌 냉혹한 현실에 때론 좌절도 하지만, 서로를 향한 사랑과 응원으로 희망을 잃지 않는다.

꿈과 사랑을 찾아 낭만과 불안 사이에서 방황하는 청춘들의 바이블."
스타의 연인,https://pedia.watcha.com/ko-KR/contents/t9PJ3Ql,한류 스타인 이마리와 명문대 국문과 대학원생 김철수가 펼쳐내는 사랑을 통해 진실된 사랑을 찾아가는 이야기를 그린 드라마
스타일,https://pedia.watcha.com/ko-KR/contents/tRp4BWG,"예뻐지고 싶은 로망을 실현해 주는 리얼 뷰티 SHOW <스타일美 7> 머리부터 발끝까지 예뻐지고 싶다면 주목! 트렌드를 이끌어가는 핫한 셀럽의 리얼 뷰티 꿀템이 공개된다! 스타들의 일상 속 꼭꼭 숨겨둔 잇템은 기본, 메이크업 및 스타일 오버를 통해 시청자의 뷰티 고민을 해결해주고, 뷰티템까지 직접 소개한다. 지금 예뻐지고 싶다면? <스타일美 7> 본방사수!"
스타트업,https://pedia.watcha.com/ko-KR/contents/tRwGMnQ,한국의 실리콘 밸리에서 성공을 꿈꾸며 스타트업에 뛰어든 청춘들의 시작(START)과 성장(UP)을 그린 드라마
스토브리그,https://pedia.watcha.com/ko-KR/contents/tlLrZk4,"팬들의 눈물마저 마른 꼴찌팀에 새로 부임한 단장이 남다른 시즌을 준비하는 뜨거운 겨울 이야기. 

프로야구 경제적 효과 2조원, 프로야구 관중 800만 시대, 역동적인 그라운드, 진한 땀 냄새에 열광하는 프로야구 팬들의 취향 저격하는 이야기. 선수가 아닌 단장을 비롯한 프런트들의 이야기다. 프로 스포츠의 조연인 프런트를 쫓아가는 이 드라마는 사실 그들이 단순 그림자가 아닌 겨울 시즌의 또 다른 주인공임을 보여줄 것이다."
스파이 명월,https://pedia.watcha.com/ko-KR/contents/t4P8W6R,북한의 미녀 스파이 명월과 남한 최고 한류스타 강우를 만나면서 벌어지는 로맨스 특공작전을 담은 드라마.
스포트라이트,https://pedia.watcha.com/ko-KR/contents/m5xJZE3,"미국의 3대 일간지 중 하나인 보스턴 글로브 내 ‘스포트라이트’팀은 가톨릭 보스턴 교구 사제들의 아동 성추행 사건을 취재한다. 하지만 사건을 파헤치려 할수록 더욱 굳건히 닫히는 진실의 장벽. 결코 좌절할 수 없었던 끈질긴 ‘스포트라이트’팀은 추적을 멈추지 않고, 마침내 성스러운 이름 속에 감춰졌던 사제들의 얼굴이 드러나는데..."
스폰서,https://pedia.watcha.com/ko-KR/contents/tRp46Ge,"원하는 것을 얻기 위해 수단과 방법을 가리지 않고, 자신의 욕망을 채워 줄 스폰서를 직접 찾아 나서는 네 남녀의 치정로맨스."
슬기로운 감빵생활,https://pedia.watcha.com/ko-KR/contents/tlnMw7P,감옥을 배경으로 미지의 공간 속 사람들이 살아가는 모습을 그린 에피소드 드라마
슬기로운 의사생활,https://pedia.watcha.com/ko-KR/contents/tPvbdo6,"누군가는 태어나고 누군가는 삶을 끝내는, 인생의 축소판이라 불리는 병원에서 평범한 듯 특별한 하루하루를 살아가는 사람들과 눈빛만 봐도 알 수 있는 20년지기 친구들의 케미스토리를 담은 드라마"
슬플 때 사랑한다,https://pedia.watcha.com/ko-KR/contents/tRaDKD9,"'쫓기는 여자, 쫓는 남자, 숨겨준 남자'
사랑은 흔하나 진짜 사랑은 힘든 시대 
진정한 사랑을 찾아가는 세 남녀의 격정 멜로 드라마"
시간,https://pedia.watcha.com/ko-KR/contents/mNdK17W,"평범한 고등학교 2학년 학생인 콘노 마코토는 어떤 사고를 계기로 본의 아니게 시간을 이동하는 능력을 얻게 된다. 어딘가 독특한 분위기를 풍기는 이모 요시야마 카즈코에게 상담을 해 본 결과, 그것은 '타임 리프'라 불리는 능력으로 마코토 또래의 여자아이들에게 자주 있는 일이라고 아무렇지도 않게 말하는 것이다. 처음에는 적지않게 당황하기도 했지만, 원하는 시간으로 되돌아가서 하고 싶었던 일, 미처 하지 못했던 일 등 원하는 것은 모두 할 수 있게 된 마코토는 세상이 전부 자기 것이 된 듯한 기분에 푹 잠긴다.

그러나 머잖아 클래스메이트이자 친한 친구 사이인 마미야 치아키와 츠다 코스케와의 관계에 미묘한 변화가 생긴다. 치아키로부터 생각지도 못한 고백을 받게 된 마코토는 당황한 나머지 타임 리프 능력을 이용해 그 고백을 강제로 없었던 것으로 만들어 버린다. 그저 세 사람의 우정이 지금처럼 이대로 계속되었으면 좋겠다고 생각했을 뿐이었지만 마코토의 바람은 점점 엉뚱한 방향으로 흘러가 버리고, 사건의 전모를 알고 있는 이모 카즈코는 ""사귀면 되지 뭘 그러니""라는 태평한 충고를 해 줄 뿐이다. 이제 마코토는 자신으로 인해 꼬여버린 관계를 풀기 위해 타임 리프 능력을 사용해 동분서주하는데..."
시그널,https://pedia.watcha.com/ko-KR/contents/tEkN4jl,현재의 형사들과 과거의 형사가 낡은 무전기로 교감을 나누며 장기 미제사건을 해결해 나간다는 내용의 드라마
시네마틱드라마 SF8,https://pedia.watcha.com/ko-KR/contents/tR726GJ,"가까운 미래를 배경으로 기술발전을 통해 완전한 사회를 꿈꾸는 인간들의 이야기, 한국판 오리지널 SF 앤솔러지(anthology) 시리즈."
시를 잊은 그대에게,https://pedia.watcha.com/ko-KR/contents/tPdZx1E,"물리치료사, 방사선사, 실습생 등 병원에서 근무하는 사람들을 다룬 드라마"
시맨틱 에러,https://pedia.watcha.com/ko-KR/contents/tPrzOrr,"컴공과 '아싸' 추상우의 완벽하게 짜인 일상에 에러처럼 나타난 안하무인 디자인과 '인싸' 장재영, 극과 극 청춘들의 캠퍼스 로맨스를 그린 왓챠 오리지널 드라마"
시지프스: the myth,https://pedia.watcha.com/ko-KR/contents/tEqZXzd,우리의 세상에 정체를 숨기고 살아가고 있는 존재를 밝혀내려는 천재공학자 한태술과 그를 위해 멀고도 위험한 길을 거슬러온 구원자 강서해의 여정을 그린 판타지 미스터리 드라마
시카고 타자기,https://pedia.watcha.com/ko-KR/contents/tE1avpE,"슬럼프에 빠진 베스트셀러 작가 세주와 그의 이름 뒤에 숨은 유령 작가 진오, 한 때 세주의 열혈 팬에서 안티 팬으로 돌변한 문인 덕후 전설, 그리고 의문의 오래된 '타자기'와 얽힌 세 남녀의 낭만적인 미스터리와 앤티크 로맨스의 만남"
시크릿 가든,https://pedia.watcha.com/ko-KR/contents/mO0mEAz,한 순간 부모를 잃고 혼자가 되어 이모부 '아치볼드'(콜린 퍼스)의 대저택에 보내진 고집불통 소녀 '메리'(딕시 에저릭스).' 아치볼드'는 '메리'에게 그녀의 방 외에는 허락없이 들어가지 말라고 경고하지만 호기심 많은 '메리'는 남몰래 저택을 돌아다니다 오랫동안 감춰져 있던 비밀의 문을 발견한다. 그 너머엔 지금껏 본 적 없는 신비롭고 아름다운 정원이 숨겨져 있었는데... 굳게 닫힌 정원의 문이 열리는 순간마법 같은 일들이 펼쳐진다!
시크릿 부티크,https://pedia.watcha.com/ko-KR/contents/tlYeZjX,강남 목욕탕 세신사에서 재벌인 데오가(家)의 하녀로 또다시 정재계 비선 실세로 거듭 성장한 제니장이 국제도시개발이란 황금알을 손에 쥐고 데오가 여제(女帝) 자리를 노리는 이야기
시티헌터,https://pedia.watcha.com/ko-KR/contents/mWw3w9G,"시티헌터 료와 파트너 카오리는 영상 제작자 앤지로부터 도망친 고양이를 찾아달라는 의뢰를 받는다. 한편, 경시청의 사에코는 수수께끼 조직의 의뢰로 만들어진 어둠의 발명품인 졸틱사의 발명품에 대해 수사한다."
시티홀,https://pedia.watcha.com/ko-KR/contents/m5ejpZW,"‘서울시 신청사’ 컨셉 디자인의 최종 당선자인 건축가 유걸은 설계와 시공과정에서 제외된 채 신청사가 만들어지는 모습을 그저 바라볼 수밖에 없었다. 서울시는 유걸을 총괄디자이너라는 이름으로 준공을 앞둔 신청사의 디자인 감리를 요청한다. 너무 늦은 합류였다. 이미 골조는 완성된 상태였고 유걸이 할 수 있는 일이 많지는 않았다. 유걸은 그래도 자신이 시청사의 마감을 돌볼 수 있어 다행이라고 생각한다. 건축가 유걸은 자신의 설계에서 가장 중요하다고 생각했던 다목적홀(Concert Hall) 설계에 집중했다. 다목적홀은 시민들이 공연이나 강연을 볼 수 있는 공간으로 유걸의 신청사 설계의 개념을 가장 잘 보여주는 핵심적인 공간이었다.
 구청사를 가리고 있던 가림막이 철거되고 신청사에 대한 사회와 여론의 비판이 쏟아졌다. 구청사와 조화가 되지 않는 최고 흉물이라며 연일 악평에 시달렸다. 신청사를 만들고 있는 실무자들도 비판적인 여론과 완공의 압박에 시달리며 지쳐갔다.
 서울시 신청사 완공까지 7년, 아무도 몰랐던 숨겨진 이야기가 시작된다."
식객,https://pedia.watcha.com/ko-KR/contents/m85XqAW,"대한민국 최고의 음식 맛을 자랑하는 운암정의 대를 잇기 위해 제자들 중 단 한 명의 요리사를 선출하는 자리. 음식에 마음을 담는 천재 요리사 ‘성찬(김강우 분)’과 승리를 위해 물불을 가리지 않는 야심가 ‘봉주(임원희 분)’ 는 후계자 자리를 놓고 대결을 펼친다. 요리대결의 과제는 황복회! 두 요리사의 실력은 우열을 가리기 힘들 정도로 맛과 모양이 뛰어난 최상급의 요리지만, 성찬의 요리를 먹은 심사위원들이 갑자기 복어 독에 중독되어 하나 둘씩 쓰러진다. 이 모습에 당황하는 성찬과 옆에서 회심의 미소를 짓고 있는 봉주. 결국, 운암정의 후계자는 봉주의 몫으로 돌아가게 되는데..
  그리고 5년후… 조선시대 최고의 요리사인 대령숙수의 칼이 발견되고, 그의 적통을 찾는 요리대회가 열리게 된다. 5년전 실수로 요리에서 손을 뗀 천재요리사 성찬은 요리대회를 취재하는 열혈VJ 진수(이하나 분)의 끊임없는 권유와 숙명적 라이벌인 봉주의 등장으로 요리 대회 참가를 결심하고, 현존하는 최고의 요리사 자리를 놓고 다시 만난 성찬과 봉주. 그리고 이 둘의 팽팽한 대결을 지켜보는 진수.
  천재 요리사 성찬을 넘어 대령숙수의 적통을 차지하려는 야심가 봉주와 그의 강력한 방해공작에도 불구하고 자신의 실력을 발휘하는 성찬은 드디어 결선에서 맞서게 되는데.. 과연 현존하는 최고의 요리사는 누가 될 것인가..."
식샤를 합시다 1,https://pedia.watcha.com/ko-KR/contents/tRz01ol,"대한민국은 지금, 네 가구 중 하나가 1인 가구! (2012년 한국 국내 가구 리포트) 이제 혼자서 무언가를 한다는 게 전혀 어색하지 않은 세상이 되어가고 있고, 1인 가구는 앞으로 자리를 확고히 할 또 하나의 라이프 스타일이다. 혼자 사는 이들은 우리를 연민하지 말라고 당부하며 행복하지도 않고 불행하지도 않은 평범한 삶이라고 말하지만 인간이란 원래 외로운 것이며, 누군가를 필요로 하는 동물! 1인 가구 입문자, 1인 가구 3년 차, 1인 가구 9년 차 세 사람의 1인가구들이 따로 또 같이 함께 사는 리얼한 모습을 가감 없이 보여주며 시끌벅적 요란법석의 삶을 재미있게 그린다."
식샤를 합시다 2,https://pedia.watcha.com/ko-KR/contents/tRaBYqP,"대한민국은 지금. 네 가구 중 하나가 1인 가구! (2012년 한국 국내 가구 리포트) 이제 혼자서 무언가를 한다는 게 전혀 어색하지 않은 세상이 되어가고 있고, 1인가구는 앞으로 자리를 확고히 할 또 하나의 라이프 스타일이다. 혼자 사는 이들은 우리를 연민하지 말라고 당부하며 행복하지도 않고 불행하지도 않은 평범한 삶이라고 말하지만 인간이란 원래 외로운 것이며, 누군가를 필요로 하는 동물! 국내 1인 가구 비율이 가장 많다는 세종시에서 삼포세대 미혼남, 결혼하고 싶은 미혼녀, 살림바보 엄친아, 자발적 1인 가구 할머니, 외로운 자유를 가진 기러기 가장, 달콤 씁쓸한 청춘 여대생 등 다양한 1인가구들이 따로 또 같이 함께 사는 리얼한 모습을 가감 없이 보여주며 시끌벅적 요란법석의 삶을 유쾌하게 그린다."
식샤를 합시다 3,https://pedia.watcha.com/ko-KR/contents/tRamv3R,다양한 인물들의 먹고 사는 이야기를 다룬 드라마
신기생뎐,https://pedia.watcha.com/ko-KR/contents/t5lYwxR,"역사에서 뿐만아니라 현존하는 최고이자 유일한 전통 기생 요리집인 부용각에서 펼쳐지는 인물들의 삶과 사랑, 아픔을 그린 드라마."
신데렐라와 네 명의 기사,https://pedia.watcha.com/ko-KR/contents/tR578Zl,"너무 다른 스무살을 건너는 극과 극 네 청춘 상상 그 이상의 심쿵유발 동거 로맨스! 혼자서 세상의 정의를 책임지기라도 할 것처럼 매사에 달려드는 소녀, 은하원! 삼형제만으로도 불협화음이 난무하던 하늘집에 위풍당당 발을 들이는데... 그 은밀한 공간 속에서, 청춘들만이 누릴 수 있는 치기와 순수함, 그리고 저돌적인 열정과 절실함, 세상 무서울 거 없는 반항과 좌절.. 이 모든 감정을 함께 느끼고, 그 찬란한 순간을 함께 즐기는 청춘남녀들의 동거담이 펼쳐진다!"
신들의 만찬,https://pedia.watcha.com/ko-KR/contents/t7EQpel,한식을 소재로 운명적으로 얽힌 두 여성요리사의 이야기를 담은 드라마
신사와 아가씨,https://pedia.watcha.com/ko-KR/contents/tPeWrLd,자신의 선택에 책임을 다하고 행복을 찾아가는 ‘아가씨’와 ‘신사’가 만나면서 벌어지는 파란만장한 이야기를 담은 드라마
신사의 품격,https://pedia.watcha.com/ko-KR/contents/tRM6n4P,"성공과 좌절, 사랑과 이별을 경험한 꽃중년 네 남자와 설레는 로맨스가 그리운 네 여자의 좌충우돌 로맨틱 코미디 드라마"
신의,https://pedia.watcha.com/ko-KR/contents/mObBeZz,"“세상은 둘 중 하나야
놀이터가 되던가, 생지옥이 되던가”

바둑으로 모든 것을 잃은 아이 ‘귀수’. 유일하게 기대던 스승 허일도(김성균)마저 잃고 홀로 살아남아 세상을 향한 복수를 계획한다.

운명의 선택은 神의 놀음판에 있다. 

자신을 사지로 내몬 냉혹한 내기바둑판으로 뛰어든 귀수(권상우)는 전국을 돌아다니며 귀신 같이 바둑을 두는 자들과 대결을 펼치는데…

사활을 건 대결
신의 한 수를 다시 두시겠습니까?"
신의 퀴즈 리부트,https://pedia.watcha.com/ko-KR/contents/tRaDKXw,한국대 법의관 사무소의 엘리트 의사들이 미궁에 빠진 의문의 죽음을 추적하고 희귀병에 얽힌 미스터리를 풀어가는 과정을 그린 드라마
신입사관 구해령,https://pedia.watcha.com/ko-KR/contents/tEkOJoz,"격동의 19세기 초, '사필을 하는 계집'이란 손가락질 속 별종 취급받던 여사들이 주인공. 남녀가 유별하고 신분에는 귀천이 있다는 해묵은 진리와 맞서며 '변화'라는 소중한 씨앗을 심는 이야기를 그린 드라마."
싸우자 귀신아,https://pedia.watcha.com/ko-KR/contents/tR486DR,귀신을 볼 줄 아는 주인공과 주인공이 만난 귀신이 동거하며 겪어가는 에피소드를 그린 드라마. 귀신을 보는 능력을 없앨 돈을 벌기 위해 귀신을 때려잡는 '허당 퇴마사' 박봉팔(옥택연)과 수능을 못 치른 한으로 귀신이 된 여고생 김현지(김소현)가 동고동락하며 함께 귀신을 쫓는 이야기를 그린다.
싸이코지만 괜찮아,https://pedia.watcha.com/ko-KR/contents/tlnN9ov,버거운 삶의 무게로 사랑을 거부하는 정신 병동 보호사 강태와 태생적 결함으로 사랑을 모르는 동화 작가 문영이 서로의 상처를 보듬고 치유해가는 한 편의 판타지. 동화 같은 사랑에 관한 조금 이상한 로맨틱 코미디
싸이코패스 다이어리,https://pedia.watcha.com/ko-KR/contents/tE0mwK2,어쩌다 목격한 살인사건 현장에서 도망치던 중 사고로 기억을 잃은 호구 육동식이 우연히 얻게 된 살인 과정이 기록된 다이어리를 보고 자신이 싸이코패스 연쇄살인마라고 착각하며 벌어지는 이야기.
쌈 마이웨이,https://pedia.watcha.com/ko-KR/contents/tPrOzVl,"태권도 유망주에서 격투기 선수로 전향한 동만, 아나운서를 꿈꾸지만 현실은 백화점 직원인 애라. 세상이 보기엔 스펙이 조금 모자란 그들이지만, 남들이 뭐라하든지 자신만의 길을 걸어나간다."
쌍갑포차,https://pedia.watcha.com/ko-KR/contents/tRMxg0q,까칠한 포차 이모님과 순수청년 알바생이 손님들의 꿈속에 들어가 맺힌 한을 풀어주는 오리엔탈 판타지 카운슬링 드라마
써클: 이어진 두 세계,https://pedia.watcha.com/ko-KR/contents/tl9wgYR,인간의 감정이 통제되어야만 인류의 미래가 있다는 신념을 가지고 지구에 온 외계인과 이에 얽힌 인간들의 이야기를 그린 드라마
썸머가이즈,https://pedia.watcha.com/ko-KR/contents/tRzLgAk,"한국판 코요테 어글리! 화끈한 해변 로맨스! 제주 해변 초호화 리조트 옆 낡아빠진 칵테일바 '썸머가이즈', 사장이자 유일한 바텐더인 '오진달래'. 뜨거운 여름 어느 날, 그녀에게 수상한 세 남자가 찾아온다. 자뻑 차도남 '선우찬', 순정파 식스팩 '박광복', 카사노바 사기꾼 '마태오'. 그들은 '썸머가이즈'를 살리기 위해 의기투합 꽃미남 바텐더 군단 '썸머가이즈'가 된다. 각각의 상처를 안고 사는 이들이 서로를 치유하는 휴먼 드라마."
아는 와이프,https://pedia.watcha.com/ko-KR/contents/tPjbBJP,한번의 선택으로 달라진 현재를 살게 된 운명적인 러브스토리를 그린 드라마
아랑사또전,https://pedia.watcha.com/ko-KR/contents/tE0Gkxl,"민담 '아랑전설'을 모티브로 한 드라마로, 자신의 죽음을 기억하지 못하는 천방지축 처녀귀신 아랑과 귀신 보는 능력을 가지고 있는 까칠 꽃미남 사또 은오를 둘러싸고 벌어지는 일들을 그린 드라마."
아름다운 그대에게,https://pedia.watcha.com/ko-KR/contents/tEkZ4nl,만화를 각색한 작품으로 꽃미남이 많기로 유명한 남고에 남장을 하고 편입한 여학생에게 벌어지는 해프닝을 그린 작품.
