title,url,summary
지금은 연애중,https://pedia.watcha.com/ko-KR/contents/tDR7oBR,"이성친구 관계에서 보여줄 수 있는 미묘한 감정들을 그린 드라마로 특히 이성친구에게 애인이 나타났을 경우 겪게 되는 여러 가지 변화를 보여주고, 인간으로서 서로를 먼저 이해하는 단계를 거처 연인으로 발전하는 관계가 가장 이상적인 연애 형태가 될 수 있음을 보여준다. 그밖에 자기가 판 함정에 자기가 빠지고 마는 카사노바의 코믹한 모습과 요즘 많은 여성들이 느끼는 외모 콤플렉스를 풍자한다."
지옥,https://pedia.watcha.com/ko-KR/contents/tRp4X5x,"암울함 속에 희망을 품은 세계관과 논쟁적인 질문을 이어받은 <지옥> 시즌2는 복잡해진 상황을 더욱 혼란스러운 방향으로 몰고 간다. 자극적인 선동을 앞세운 화살촉이 세력을 늘려가는 가운데 통제할 수 없는 상황을 원치 않던 정부는 새 진리회를 이용해 새로운 질서를 세우고자 한다. 한편 시연 당했던 정진수가 부활하면서 새진리회, 화살촉, 소도 세 세력이 각자의 목적으로 충돌한다. 시즌1이 불가해한 현상을 둘러싸고 각자의 질문과 해석이 충돌하는 인간들의 ‘반응’에 관한 서사였다면, 시즌2는 집단의 이해와 욕망이 충돌하며 만들어질 지옥 자체에 초점을 맞춘다. 연상호 감독 특유의 디스토피아적 분위기와 인간을 향한 질문과 시선은 한층 강화됐다. 새롭게 정진수 역할을 맡은 김성철 배우 역시 쉽지 않은 변화와 공백을 설득력 있게 대체했다. (송경원) [제29회 부산국제영화제]"
진검승부,https://pedia.watcha.com/ko-KR/contents/tlYemLV,"불량함과 껄렁함으로 무장한 검사가 부와 권력이 만든 성역, 그리고 그 안에 살고 있는 욕심쟁이들까지 시원하게 깨부수는 이야기"
진실,https://pedia.watcha.com/ko-KR/contents/mOlwgNe,"“엄마, 이 책에는 진실이라고는 없네요”

자신의 회고록 발간을 앞둔 전설적인 여배우 파비안느(까뜨린느 드뇌브). 이를 축하하기 위해 딸 뤼미르(줄리엣 비노쉬)가 남편 행크(에단 호크), 어린 딸 샤를로트와 함께 오랜만에 파비안느의 집을 찾는다. 반가운 재회도 잠시, 엄마의 회고록을 읽은 뤼미르는 책 속 내용이 거짓으로 가득 찼음을 알게 되는데…"
진심이 닿다,https://pedia.watcha.com/ko-KR/contents/tEgMqVV,"어느 날, 드라마처럼 로펌에 뚝 떨어진 대한민국 대표 여배우 오윤서가 완벽주의 변호사 권정록을 만나 시작되는 우주여신 위장취업 로맨스"
질투의 화신,https://pedia.watcha.com/ko-KR/contents/tR28Vvl,질투라곤 몰랐던 마초기자와 재벌남이 생계형 기상캐스터를 만나 질투로 스타일 망가져가며 애정을 구걸하는 양다리 로맨스
징크스의 연인,https://pedia.watcha.com/ko-KR/contents/tRX5JXd,불행한 자신의 삶을 숙명으로 여기고 순응하며 사는 한 인간 남자와 저주를 풀기 위해 미지의 세상 밖으로 뛰어든 여신이 잔혹한 운명을 뛰어넘으며 펼치는 판타지 로맨스 드라마
짠내 아이돌,https://pedia.watcha.com/ko-KR/contents/tlGNVdB,화려해 보이는 K-POP 아이돌. 하지만 그들의 실제 모습도 그러할까? 인기 그룹 내 비인기 멤버의 처절한 생존기를 그린 코믹 드라마
착한마녀전,https://pedia.watcha.com/ko-KR/contents/tlYyVAl,‘마녀’와 ‘호구’ 사이를 아슬아슬 넘나드는 ‘천사표 아줌마’의 빵 터지는 이중 생활극
찬란한 유산,https://pedia.watcha.com/ko-KR/contents/m1WwAEd,"플로리다 걸프 해안의 작은 마을에 사는 8살의 핀 벨(Finnegan Bell: 에단 호크 분)은 누나와 함께 산다. 가난한 집안형편이지만 화가가 꿈인 핀은 아름다운 바다를 그리며 자신의 꿈을 키워나간다. 어느날 그는 탈옥한 죄수 루스티그(Prisoner - Lustig: 로버트 드니로 분)를 우연히 만나 그의 발목에 찬 족쇄를 풀어주면서, 그의 단순하고 평화로운 생활이 깨어짐을 느낀다. 인근에서 가장 부자로 소문나 있는 노라 딘스무어 여사(Ms. Dinsmoor: 앤 밴크로프트 분)로부터 갑작스런 초대를 받게 된 핀은 그녀의 은둔자적인 비밀스런 삶에 두려워 하면서도 그녀의 조카인 에스텔라(Estella: 기네스 팰트로 분)에 대한 막연한 동경과 사랑으로 매일 그녀를 찾는다. 에스텔라는 그런 핀에게 상류사회 특유의 냉정함과 오만함으로 일관하지만 핀이 그녀를 그린 그림에 깊은 인상을 받는다. 에스텔라를 사랑한다면 그의 마음만 아플거라는 노라의 충고에도, 어느새 커버린 그들은 서로에 대한 호감을 억누를 수 없다. 노라의 말대로 에스텔라는 홀연히 파리로 떠나버리고 절망에 빠져 헤매던 핀은 그림그리기를 포기한 채 나날을 보낸다. 갑작스런 익명의 후원자 덕분에 뉴욕에 보내진 그는 화가로서의 꿈을 이루며 뉴욕 미술계의 유망주로 떠오른다. 부와 지위, 명성을 한꺼번에 얻게 된 핀은 에스텔라와의 갑작스런 재회에 행복해 하지만 그녀는 다른 남자의 청혼을 받아들였다는 한마디 말로 그에게 또한번 깊은 상처를 남긴다. 괴로워 하는 핀 앞에 갑자기 나타난 루스티그는 상황을 더욱 복잡하게 만들며 그가 누리는 위대한 유산의 의미를 깨우쳐 주는데."
참치와돌고래,https://pedia.watcha.com/ko-KR/contents/tR72by9,동네 수영장에서 펼치는 예측불허 로맨스를 다룬 드라마
천국의 계단,https://pedia.watcha.com/ko-KR/contents/md7g4Nd,"제2차 세계 대전이 끝날 무렵, 영국의 폭격기 조종사인 피터(Squadron Leader Peter D. Carter: 데이비드 니븐 분)는 추락하는 비행기 속에서 죽음을 맞을 위기에 처한다. 죽음을 앞둔 피터는 지상에 있는 미국인 여성 무선사 준(June: 킴 헌터 분)과 마지막 대화를 하게 되고 그녀의 목소리에서 사랑을 느끼지만 비행기에서 맨몸으로 뛰어내리는 선택을 한다. 하지만 피터가 정신을 차렸을 때 그는 무사히 생명을 건진 상태, 약간의 뇌 손상 외에는 별탈이 없다. 게다가 우연히 준과 마주쳐 사랑에 빠지기까지 한다.
  하지만 두 사람의 사랑에는 문제가 있었다. 피터는 살아서는 안 되는 운명이었기 때문이다. 그가 살아난 것은 천국의 실수였고 이 사실이 알려지면서 천국에서는 비상이 걸린다. 천국의 사자(Conductor 71: 마리어스 고링 분)는 사고를 수습하기 위해 급파되고 이때부터 영화는 준과 리브스 박사((Doctor Frank Reeves: 로저 리브세이 분)의 도움 아래 지상에 남아 있으려는 피터의 몸부림을 보여준다. 특히 이런 갈등은 지상에서의 피터의 뇌수술과 천국에서의 재판을 통해 보여지고, 결국 천상의 실수로 피터와 준이 사랑에 빠졌기 때문에 살려야한다는 특이한 호소 아래 피터는 성공적인 뇌수술을 하게 되고 지상에 돌아와 준과 결합한다."
천국의 눈물,https://pedia.watcha.com/ko-KR/contents/tEgrA5l,자신밖에 모르는 매몰찬 모정에 두 번이나 짓밟힌 딸과 자신이 쌓아온 공든 탑을 지키려는 비정한 엄마의 비극적인 전쟁을 그린 드라마.
천원짜리 변호사,https://pedia.watcha.com/ko-KR/contents/tPeWBO5,"수임료는 단돈 천원 실력은 단연 최고, ‘갓성비 변호사’ 천지훈이 빽 없는 의뢰인들의 가장 든든한 빽이 되어주는 통쾌한 변호 활극!"
천일의 약속,https://pedia.watcha.com/ko-KR/contents/tkPjy0R,기억을 잃어가는 여자와의 사랑을 지키는 한 남자의 사랑이야기를 그린 드라마.
철인왕후,https://pedia.watcha.com/ko-KR/contents/tEm9B8W,'철인왕후' 본편에서 보여주지 못했던 에피소드를 담은 에필로그
첫사랑,https://pedia.watcha.com/ko-KR/contents/tRaD3o8,
첫사랑은 처음이라서,https://pedia.watcha.com/ko-KR/contents/tEKzONQ,"스무 살 독립, 문란해질 준비는 끝났다. 화끈한 로맨스를 꿈꾸는 태오. 하지만 친구들이 각자의 사정으로 집에 쳐들어오면서, 기대하지 않았던 좌충우돌 동거가 시작된다. 도대체 어디까지가 우정이고 어디까지가 썸인건지. 첫 인생이라서 어렵고, 첫사랑이라서 서툰 생초보들이 한집에 모였다."
청담동 앨리스,https://pedia.watcha.com/ko-KR/contents/tlnooeE,결혼을 일생일대의 비지니스로 삼은 여자의 '청담동 며느리 되기 프로젝트'와 남자를 통해 신데렐라가 되기를 꿈꾸는 여자들의 속물근성을 경멸하는 남자의 '멸종된 사랑찾기 프로젝트'라는 동상이몽을 그리는 드라마로 대한민국을 지배하는 부와 진정한 결혼의 의미를 되새겨 보는 드라마
청춘,https://pedia.watcha.com/ko-KR/contents/tPVyM4R,벨에포크라는 이름의 셰어하우스에 모여 사는 5명의 청춘들을 중심으로 벌어지는 이야기
청춘기록,https://pedia.watcha.com/ko-KR/contents/tRX5mYm,현실의 벽에 절망하지 않고 스스로 꿈과 사랑을 이루기 위해 노력하는 청춘들의 성장 기록.
청춘시대,https://pedia.watcha.com/ko-KR/contents/tPVyM4R,벨에포크라는 이름의 셰어하우스에 모여 사는 5명의 청춘들을 중심으로 벌어지는 이야기
청춘시대 2,https://pedia.watcha.com/ko-KR/contents/tPVyM4R,벨에포크라는 이름의 셰어하우스에 모여 사는 5명의 청춘들을 중심으로 벌어지는 이야기
초면에 사랑합니다,https://pedia.watcha.com/ko-KR/contents/tE6YkZQ,보이는 게 없어지고 나서야 비로소 사람을 제대로 보게 된 냉혈한 보스의 자아 찾기이자 부모도 몰라보는 보스를 속여먹다 급기야 그 남자를 사랑하게 된 다혈질 비서의 사랑 찾기인 사기충전 로맨스 드라마
초콜릿,https://pedia.watcha.com/ko-KR/contents/m5m6aDW,"세계적인 초콜릿과 과자 재벌 윌리 윙커(Willy Wonka: 진 와일더 분)는 어느날 100개의 초콜릿 상자 속에 단 5개의 황금 티켓을 넣어 발매하였다는 발표를 한다. 티켓을 찾아낸 어린이들은 평생 동안 웡카 초콜릿을 무상으로 공급받을 수 있고, 비밀에 싸인 웡카 공장의 견학을 할 수 있는 자격이 생긴다. 온세계는 웡카 열풍에 휩싸이고, 어른이며 애며 할 것없이 웡카 초콜릿을 박스째로 사다가 뜯어본다. 한반 아이들은 평균 수백개의 초콜릿을 사본 경험이 있을 정도로 대 인기를 얻은 이벤트가 되었다. 하지만, 집이 가난한 찰리(Charlie: 피터 오스트럼 분)는 친조부모와 외조부모, 그리고 혼자된 어머니를 모시고 살며, 가족의 끼니 걱정을 하는 어린이이다. 수백개의 상자를 뜯고 있는 사람들의 모습은 찰리에겐 너무나도 먼 일이지만, 할머니와 할아버지들은 어렵게 모은 돈으로 찰리에게 웡카 초콜릿을 선물한다. 헛된 꿈을 키우는 것을 원치않는 찰리의 어머니는 반대하지만, 겉으로 내색않는 찰리에게도 남들의 이야기는 마냥 부럽다. 영국, 미국, 독일 등지에서 황금 티켓을 가진 어린이들이 나타난다. 마지막 한개의 티켓은 남미의 어느 나라에서 발견되고 찰리에게는 더 이상 별다른 희망이 없다. 길을 걷다가 커다란 은화를 발견한 찰리는 먹고 싶던 초콜릿을 두 개 산다. 하나는 자신을 위해 하나는 할아버지(Grandpa Joe: 잭 알버트슨 분)를 위해. 그때, 남미에서 발견된 황금 티켓이 위조된 것이라는 뉴스 발표가 나온다. 찰리는 할아버지를 위해 남겨둔 마지막 초콜릿 포장을 뜯고. 그 안에 든 것은 이제 전 세계에 단 하나 남은 황금티켓. 한명의 동반자만을 허용한다는 웡카 회사의 이야기를 들은 찰리는 할아버지와 함께 가기로 하고, 공장 견학의 날, 다섯 어린이들은 각자의 부모와 함께 공장앞에 모인다. 윌리 웡카가 안내하는 초콜릿 공장. 어린이들은 이제껏 어디서도 본 적 없는 꿈과 환상의 세계에 들어가게 되는데."
총각네 야채가게,https://pedia.watcha.com/ko-KR/contents/t7EQpAl,최선을 다해 치열한 삶을 사는 청춘들의 일과 꿈 그리고 사랑을 다룬 드라마.
총리와 나,https://pedia.watcha.com/ko-KR/contents/tEkzJ5l,고집불통 대쪽 총리 이범수와 결혼하고 싶어 안달 난 20대 천방지축 여기자 윤아의 로맨스를 담은 작품.
최강 배달꾼,https://pedia.watcha.com/ko-KR/contents/tln7mzE,가진 것이라곤 배달통뿐인 인생들의 통쾌한 뒤집기 한 판을 그린 신속정확 열혈 청춘배달극
최고다 이순신,https://pedia.watcha.com/ko-KR/contents/tPedgoR,아버지의 죽음을 계기로 맞닥뜨린 새로운 운명의 소용돌이에 휩쓸리게된 엄마와 막내딸의 행복찾기와 사랑이야를 다룬 드라마.
최고의 결혼,https://pedia.watcha.com/ko-KR/contents/tlGmBZR,자발적 비혼모를 선택한 스타앵커를 중심으로 각기 다른 네 커플의 이야기를 통해 연애와 결혼 얘기를 그린 드라마
최고의 사랑,https://pedia.watcha.com/ko-KR/contents/tPjZWJP,메이킹 된 호감으로 전국민이 사랑하는 남자와 매도된 비호감으로 전국민이 욕하는 여자의 좌충우돌 사랑이야기를 그린 로맨스 코미디 드라마.
최고의 엔딩,https://pedia.watcha.com/ko-KR/contents/tRMeAwR,경찰서에서 의뢰 받은 시신의 장례를 다루는 장의사와 신참 여형사가 운반되어 오는 시신들과 고인들에 얽힌 사연들에 세상사의 삶을 배워 가는 이야기.
최고의 이혼,https://pedia.watcha.com/ko-KR/contents/tlYm84l,"'결혼은 정말 사랑의 완성일까?'라는 물음에서 시작해, 사랑, 결혼, 가족에 대한 남녀의 생각 차이를 유쾌하고 솔직하게 그리는 러브 코미디 드라마. 일본 드라마 <최고의 이혼> 한국판 리메이크"
최고의 한방,https://pedia.watcha.com/ko-KR/contents/tRBL67l,"사랑하고, 이야기하고, 먹고 사는 것을 치열하게 고민하는 이 시대의 20대 청춘 소란극 드라마"
추노,https://pedia.watcha.com/ko-KR/contents/t4P8ndE,조선시대를 배경으로 역사조차 담진 못했던 쫓기는 노비와 그를 쫓는 노비 사냥꾼의 추격전을 그린 드라마.
추리의 여왕,https://pedia.watcha.com/ko-KR/contents/tE32WJl,생활밀착형 추리퀸 설옥과 하드보일드 베테랑 형사 완승이 환상의 공조 파트너로 거듭나 범죄로 상처입은 이들의 마음까지 풀어내는 휴먼 추리드라마
추리의 여왕 2,https://pedia.watcha.com/ko-KR/contents/tE32WJl,생활밀착형 추리퀸 설옥과 하드보일드 베테랑 형사 완승이 환상의 공조 파트너로 거듭나 범죄로 상처입은 이들의 마음까지 풀어내는 휴먼 추리드라마
출사표,https://pedia.watcha.com/ko-KR/contents/tlYeWpQ,취업 대신 출마를 외친 청년들과 '정치 만렙' 의원들의 이야기를 담은 명랑 코믹 정치 오피스 드라마
치얼업,https://pedia.watcha.com/ko-KR/contents/tR5Kg79,한때 화려했던 역사를 가진 망해가는 대학교 응원단 배경의 미스터리 캠퍼스 로맨틱 코미디
치즈 인 더 트랩,https://pedia.watcha.com/ko-KR/contents/m533DR6,"부드러운 미소 뒤에 숨겨진 싸늘한 모습. 피하고 싶은 '유정(박해진)' 선배가 갑자기 나에게 다가와 말을 걸기 시작했다. 함께 밥 먹고, 함께 과제하고, 조별 숙제 핑계로 영화도 보고... 그가 달라진 걸까. 아님 다른 꿍꿍이가 있는 걸까. 아니면 정말 나를...? 
  
""설아, 나랑 사귈래?"" 
완벽하지만 위험한 선배의 달콤한 덫에 걸렸다."
친구보다 더,https://pedia.watcha.com/ko-KR/contents/boYrrWG,"기존의 인간관계 전문가들은 언제나 ‘가장 가까운 인간관계’에 대해서만 초점을 맞춰왔다. 물론 가까운 인간관계에 더 많은 관심을 쏟아야 하는 것은 당연하지만 사소하지만 중요한 영향을 미치는 주변인들도 우리가 집 밖으로 나올 수 있게 돕는 역할을 하는 중요한 매개체이다. 이 책은 바로 사소하게 보이지만 중요한 관계를 맺고 있는 주변인들에 주목한 책이다.

이 책은 주변인과의 관계를 ‘중요한 이방인’이라는 단어로 색다르게 정의하며 이들이 우리 삶에 미치는 영향력에 대해 이야기한다. 또한 우리의 자아를 개발하거나 어려움에 부딪혔을 때 침착하게 대응하기 위해 다양한 부류의 중요한 이방인을 잘 알아두는 것이 얼마나 도움이 될 수 있는지에 대해 말한다. 중요하지 않게 느껴지지만 사실은 의미 있는 ‘중요한 이방인’을 총 7장에 걸쳐서 파헤친다."
친애하는 판사님께,https://pedia.watcha.com/ko-KR/contents/tE1ZdgR,"전과 5범 한강호, ‘친애하는 판사님’ 되다! 실종된 형을 대신해 전과 5범 한강호가 판사가 되어 법정에 서게 된다. ‘실전 법률’을 바탕으로 법에 없는 통쾌한 판결을 시작하는 얼렁뚱땅 불량 판사 성장기!"
카이로스,https://pedia.watcha.com/ko-KR/contents/tRaDMQb,"10시 33분. 운명을 바꿀 단 1분의 시간. 

전화벨이 울리면 시간을 관통하는 1분의 공조가 시작된다. 유괴된 어린 딸을 되찾아야 하는 미래의 남자 서진과 잃어버린 엄마를 구해야 하는 과거의 여자 애리가 사랑하는 사람을 위해 시간을 가로질러 고군분투하는 타임 크로싱 판타지 스릴러"
캐리어를 끄는 여자,https://pedia.watcha.com/ko-KR/contents/tEKB3kl,"특유의 매력과 재치로 서초동 바닥을 주름잡던 여성 사무장이 한순간의 몰락 이후, 자신의 꿈과 사랑을 쟁취하며 재기에 성공하는 성장 스토리 & 법정 로맨스"
커피 한잔 할까요,https://pedia.watcha.com/ko-KR/contents/tE0m2Xx,순수한 열정만으로 커피의 세계에 뛰어든 신입 바리스타 '강고비'가 커피 명인 '박석'의 수제자가 되면서 커피와 사람에 대해 배워가는 모습을 그린 감성 휴먼 드라마
커피프린스 1호점,https://pedia.watcha.com/ko-KR/contents/tEK2x2l,남자 행세를 하는 스물네 살의 여주인공과 정략결혼을 피하기 위해 동성애자인 척하는 남자 주인공이 커피프린스 1호점에서 펼치는 사랑이야기
컬러 러쉬,https://pedia.watcha.com/ko-KR/contents/mWz3VpD,색을 볼 수 없는 모노가 색을 볼 수 있게 만드는 프로브를 만나 서로에게 새로운 에너지를 주며 사랑을 키워나가는 과정을 그린 청춘 영화
쾌걸 춘향,https://pedia.watcha.com/ko-KR/contents/tZPV9wR,"고전 '춘향전'을 현대식으로 해석하여 엽기발랄 춘향이를 통해 진정한 사랑의 가치를 발견하는 드라마로 남원의 대표얼짱 성춘향이 불량 전학생 이몽룡을 만나는 것에서 출발한다. 알바를 위해 광한루 월담을 하던 춘향은 남원 경찰서장의 말썽쟁이 아들 몽룡에게 치맛속을 들킨다. 홧김에 춘향은 몽룡의 핸드폰을 망가뜨리고 몽룡은 춘향의 핸드폰을 뺏어 달아난다. 견원지간처럼 티격티격하는 두 사람. 몽룡의 장난으로 춘향은 연못에 빠져 그만 감기에 걸리고 몽룡은 춘향집에 병문안을 갔다가 실수로 과실주를 마시고 춘향 곁에서 잠이 들고 만다. 다음날 출장에서 돌아온 월매, 둘의 야릇한 동침현장에 기절초풍하는데."
크레이지 러브,https://pedia.watcha.com/ko-KR/contents/tR4JqyL,살인예고에 기억상실증을 연기하는 개차반 대표와 그의 약혼녀를 연기하는 존재감 제로 여비서의 달콤 살벌 대 환장 크레이지 로맨스
크로스,https://pedia.watcha.com/ko-KR/contents/m5mYJqm,"세계일주여행을 앞둔 어느 날 어디서나 마주칠 수 있을 것 같은 평범한 남자 `다니`는 식당에서 우연히 `밀라`를 만나고 평소와 다르게 일탈을 즐기며 낯선 밤을 보낸다.

그날 밤, `밀라`에게 이끌려 난생처음 문신을 새기고 집까지 따라가게 된 ‘다니’는 뜻하지 않은 사건에 휘말려 우발적으로 살인을 저지르고 만다.
 
아직 용의 선상에 오르지 않은 `다니`는 사람들을 피해 도심 속으로 숨어들지만, 지루한 드라마 같던 삶을 반전시킨 단 한 번의 실수는 계속해서 그를 벗어날 수 없는 악몽 속으로 끌고 가는데…"
크리미널 마인드,https://pedia.watcha.com/ko-KR/contents/tRp40wx,"FBI 프로파일러로 구성된 정예 팀이 미국에서 가장 뒤틀린 범죄자들의 심리를 분석하고, 범죄를 또 저지르기 전에 다음 수를 예측한다. 팀원들은 함께 성장하며, 이 행동 분석팀은 전문 지식으로 범죄자의 동기를 찾아내고 범죄를 저지하는 노력을 계속한다."
키스 먼저 할까요,https://pedia.watcha.com/ko-KR/contents/tRXdnDR,"성숙한 사람들의 서툰 멜로 ""키스 한 번으로 죽었던 연애세포가 살아나다. 그리고...진짜 사랑..."""
키스식스센스,https://pedia.watcha.com/ko-KR/contents/tR72W4Y,"키스하면 미래를 보는 능력을 가진 예술이, 실수로 상사 차민후의 목에 키스한 후 두 사람의 19금 미래를 보게 되면서 벌어지는 사건을 담은 작품"
"킬미, 힐미",https://pedia.watcha.com/ko-KR/contents/tEqn1YR,"다중 인격 장애를 소재로, 일곱 개의 인격을 가진 재벌 3세와 그의 비밀 주치의가 된 레지던트 1년 차 여의사의 버라이어티한 로맨스를 그린 힐링 로맨틱 코미디 드라마"
킬힐,https://pedia.watcha.com/ko-KR/contents/tR72qgA,"홈쇼핑에서 벌어지는 세 여자들의 끝없는 욕망과 처절한 사투, 성공과 질투에 눈 먼 세 여자의 무기 하나 없는 전쟁 드라마"
킹덤,https://pedia.watcha.com/ko-KR/contents/mdB7AK9,비극과 배신이 삶을 덮친다. 기이하고 불길한 뭔가를 발견한다. 한순간에 가족과 동족을 잃은 여인. 오직 복수를 꿈꾸며 살아온 그녀가 짙은 어둠을 마주한다.
킹덤2,https://pedia.watcha.com/ko-KR/contents/tPeWzyB,"죽었던 왕이 되살아나자 반역자로 몰린 왕세자가 향한 조선의 끝, 그곳에서 굶주림 끝에 괴물이 되어버린 이들의 비밀을 파헤치며 시작되는 미스터리 스릴러"
타인은 지옥이다,https://pedia.watcha.com/ko-KR/contents/tPd3zBM,"모든 것이 낯선 고시원을 배경으로 수상한 사람들의 이야기를 다루는 스릴러 드라마. 
어느 날 윤종우에게 걸려온 전화 한 통. 서울에서 창업을 했는데 일손이 필요하다는 대학 선배인 재호다. 풀리는 일 없는 고향 생활에 내심 지겨움을 느끼던 종우는 흔쾌히 상경을 결정하고, 서울 변두리의 낡은 고시원에 입주하는데...그 날 밤부터 시작된 고시원 사람들의 기행. 하나, 둘 없어지는 사람들, 이어지는 소름 끼치는 상황들. 그들이 이상한 건지, 자신이 이상한 건지 점차 혼란을 느끼기 시작하는 종우. 그리고 종우는 어느새, 자신이 지옥의 한 가운데 있었음을 깨닫게 되는데..."
타임즈,https://pedia.watcha.com/ko-KR/contents/m5rQ3l3,베트남전 당시 미국사회의 혼란상을 풍자한 스릴러 영화
탁구공,https://pedia.watcha.com/ko-KR/contents/tEZABx8,대학생 청년이 의문의 노숙자를 만나 이루지 못한 지난 사랑에 대한 동질감과 감정의 전이를 경험하는 과정에서 겪는 혼란과 진실에 대한 이야기를 그린 독특한 형식의 버디 드라마
태양의 후예,https://pedia.watcha.com/ko-KR/contents/tEK2B2l,아름다운 남국의 풍광을 배경으로 펼쳐지는 힐링 로맨스로 기적이 아닌 사랑을 믿어 그 사랑으로 기적을 이루어내는 우리 마음 속 영웅들의 이야기를 그린다. UN의 요청으로 우르크의 수도에 주둔한 UN평화유지군 소속 부대 특전경비팀 대위 유시진과 의사 강모연이 한국과 파병 지역을 오가며 사랑을 나누는 내용.
태조 왕건,https://pedia.watcha.com/ko-KR/contents/tlOqJwR,고려를 건국한 태조 왕건의 이야기를 그린 드라마
